{
  "$schema": "https://json-schema.org/draft/2020-12/schema",
  "$id": "https://beyond10x.github.io/schema/b10x.protocol-graph.v1.json",
  "title": "b10x protocol graph",
  "description": "A Canon protocol as nodes and edges, emitted from canon-ir/1 for the ProtocolGraph renderer. Nodes are ordered by kind (action, evidence, claim, outcome, obligation), then by name. An optional case section declares the case inputs (canon-ir/1 case.inputs) that input predicate leaves test, and an obligation may carry applicable_when, the predicate under which it applies. Predicates may use the canon-ir/1 order forms first, before and after.",
  "type": "object",
  "additionalProperties": false,
  "required": ["format", "protocol", "nodes", "edges"],
  "properties": {
    "format": {"const": "b10x-protocol-graph/1"},
    "case": {
      "type": "object",
      "additionalProperties": false,
      "required": ["inputs"],
      "description": "Case inputs as canon-ir/1 declares them: each input names the values a case may give it. Input predicate leaves may name only these inputs and values.",
      "properties": {
        "inputs": {
          "type": "object",
          "propertyNames": {"type": "string", "minLength": 1},
          "additionalProperties": {
            "type": "object",
            "additionalProperties": false,
            "required": ["values"],
            "properties": {
              "description": {"type": ["string", "null"], "minLength": 1},
              "values": {"type": "array", "minItems": 1, "uniqueItems": true, "items": {"type": "string", "minLength": 1}}
            }
          }
        }
      }
    },
    "protocol": {
      "type": "object",
      "additionalProperties": false,
      "required": ["id", "revision"],
      "properties": {
        "id": {"type": "string", "minLength": 1},
        "revision": {"type": "integer", "minimum": 1},
        "description": {"type": "string", "minLength": 1},
        "source": {"type": "string", "minLength": 1, "description": "Where the protocol came from, shown under the graph."}
      }
    },
    "nodes": {
      "type": "array",
      "items": {
        "type": "object",
        "additionalProperties": false,
        "required": ["id", "kind", "name"],
        "properties": {
          "id": {"type": "string", "minLength": 1, "description": "Unique; by convention <kind>:<name>."},
          "kind": {"enum": ["action", "evidence", "claim", "outcome", "obligation"]},
          "name": {"type": "string", "minLength": 1},
          "description": {"type": "string", "minLength": 1},
          "predicate": {"$ref": "#/$defs/predicate", "description": "Claim true_when, outcome requires, or action precondition; omit an empty all."},
          "effect": {"type": "string", "minLength": 1},
          "capabilities": {"type": "array", "items": {"type": "string", "minLength": 1}},
          "applicable_when": {"$ref": "#/$defs/predicate", "description": "Obligations only: the predicate under which the obligation applies (canon-ir/1 applicable_when); omitted when it always applies."}
        },
        "allOf": [{"if": {"properties": {"applicable_when": true}, "required": ["applicable_when"]}, "then": {"properties": {"kind": {"const": "obligation"}}}}]
      }
    },
    "edges": {
      "type": "array",
      "items": {
        "type": "object",
        "additionalProperties": false,
        "required": ["from", "to", "kind"],
        "properties": {
          "from": {"type": "string", "minLength": 1},
          "to": {"type": "string", "minLength": 1},
          "kind": {"enum": ["produces", "establishes", "supports", "requires", "gates"], "description": "produces action→evidence; establishes evidence→claim; supports claim→claim; requires claim→outcome; gates claim→action."},
          "qualifier": {"type": "string", "minLength": 1, "description": "Evidence result, or a claim value other than true."}
        }
      }
    }
  },
  "$defs": {
    "predicate": {
      "oneOf": [
        {"type": "object", "additionalProperties": false, "required": ["all"], "properties": {"all": {"type": "array", "items": {"$ref": "#/$defs/predicate"}}}},
        {"type": "object", "additionalProperties": false, "required": ["any"], "properties": {"any": {"type": "array", "items": {"$ref": "#/$defs/predicate"}}}},
        {"type": "object", "additionalProperties": false, "required": ["not"], "properties": {"not": {"$ref": "#/$defs/predicate"}}},
        {
          "type": "object",
          "additionalProperties": false,
          "required": ["claim"],
          "properties": {"claim": {"type": "object", "additionalProperties": false, "required": ["id"], "properties": {"id": {"type": "string", "minLength": 1}, "is": {"enum": ["true", "false", "unknown"]}}}}
        },
        {
          "type": "object",
          "additionalProperties": false,
          "required": ["evidence"],
          "properties": {"evidence": {"type": "object", "additionalProperties": false, "required": ["kind"], "properties": {"kind": {"type": "string", "minLength": 1}, "result": {"type": ["string", "null"], "minLength": 1}}}}
        },
        {
          "type": "object",
          "additionalProperties": false,
          "required": ["input"],
          "properties": {"input": {"type": "object", "additionalProperties": false, "required": ["id", "in"], "properties": {"id": {"type": "string", "minLength": 1}, "in": {"type": "array", "minItems": 1, "uniqueItems": true, "items": {"type": "string", "minLength": 1}}}}}
        },
        {
          "type": "object",
          "additionalProperties": false,
          "required": ["first"],
          "description": "canon-ir/1 order form: true when the first evidence of kind (about subject, when one is named) has result.",
          "properties": {"first": {"type": "object", "additionalProperties": false, "required": ["kind", "result"], "properties": {"kind": {"type": "string", "minLength": 1}, "result": {"type": "string", "minLength": 1}, "subject": {"type": "string", "minLength": 1}}}}
        },
        {
          "type": "object",
          "additionalProperties": false,
          "required": ["before"],
          "description": "canon-ir/1 order form: true when evidence of kind first (about subject, when one is named) precedes evidence of kind then. The renderer refuses a first equal to then.",
          "properties": {"before": {"type": "object", "additionalProperties": false, "required": ["first", "then"], "properties": {"first": {"type": "string", "minLength": 1}, "then": {"type": "string", "minLength": 1}, "subject": {"type": "string", "minLength": 1}}}}
        },
        {
          "type": "object",
          "additionalProperties": false,
          "required": ["after"],
          "description": "canon-ir/1 order form (Canon 0.7.0): true when evidence of kind then.kind with result then.result (about subject, when one is named) was observed after the first evidence of kind first. The two kinds may be the same.",
          "properties": {"after": {"type": "object", "additionalProperties": false, "required": ["first", "then"], "properties": {"first": {"type": "string", "minLength": 1}, "then": {"type": "object", "additionalProperties": false, "required": ["kind", "result"], "properties": {"kind": {"type": "string", "minLength": 1}, "result": {"type": "string", "minLength": 1}}}, "subject": {"type": "string", "minLength": 1}}}}
        }
      ]
    }
  }
}
